{
  "id": "D47",
  "title": "The window is fixed: at the start of a minute, a full counter of the minute has 60 seconds left.",
  "role": "pdp",
  "paragraphs": [
    "6.3"
  ],
  "requirement": "MUST",
  "given": {
    "directory": "budgets.json",
    "clock": {
      "now": 1792569600
    },
    "counters": [
      {
        "subject": "quad",
        "limit": "requests",
        "window": "minute",
        "used": 1
      }
    ]
  },
  "steps": [
    {
      "name": "The clock is at the start of the minute",
      "request": {
        "endpoint": "evaluation",
        "body": {
          "subject": {
            "type": "user",
            "id": "quad"
          },
          "action": {
            "name": "data.read"
          },
          "resource": {
            "type": "database",
            "id": "test1",
            "properties": {
              "ancestors": [
                {
                  "type": "service",
                  "id": "datastore"
                },
                {
                  "type": "host",
                  "id": "prod"
                }
              ]
            }
          },
          "context": {
            "usage": {
              "units": 1
            }
          }
        }
      },
      "expect": {
        "status": {
          "equals": 200
        },
        "json": {
          "/decision": {
            "equals": false
          },
          "/context/reason": {
            "equals": "budget_exceeded"
          },
          "/context/retry_after": {
            "equals": 60
          },
          "/context/limits": {
            "absent": true
          },
          "/context/usage": {
            "absent": true
          }
        }
      }
    }
  ]
}
